review,cleaned_review
"202.
That’s the number of times that the word “mate,” in any of its hellish forms, is used in this book.
TWO.
HUNDRED.
AND.
TWO.
https://emmareadstoomuch.wordpress.co...
That statistic alone should be enough to justify this one star rating. If you feel satisfied enough to just remove yourself from t",number time word mate hellish form used book two hundred two statistic alone enough justify star rating feel satisfied enough remove run feeling like seven page sh complain efficient never efficient reviewer life counted two hundred two us word seven hundred page scream rational control passionate f
"I need a black silk robe and a balcony to wear it on because if I’m gonna drag myself around my house still being disappointed, I at least wanna look good.
❗ full disclosure❗ there will be so many bad vibes around this review, it's like in the prisoner of azkaban you’ll need to charge all the negati",need black silk robe balcony wear gon na drag around house still disappointed least wan na look good full many bad vibe around like prisoner azkaban need charge negativity away stag bc salt bitterness seeping follicle literally bottomless pit negativity right raise arm sensually embrace metaphorical
"THIS BOOK TOTALLY WRECKED ME. In the best possible way (because I’m thrilled to cry for a day straight? Idk). First of all, the scope of this story is extraordinary. Events from the first half that seemed so important at the time now feel like minuscule details in the face of this EPIC PLOT.
I love ",book totally wrecked best possible thrilled cry day straight idk first scope story extraordinary event first half seemed important time feel like minuscule detail face epic plot love maas writes complex character life shattered variety way yet still keep fighting work create new life family chose fe
"3.75 stars
""Rhys stepped off the stairs and took my hand.
Night Triumphant—and the Stars Eternal.
If he was the sweet, terrifying darkness, I was the glittering light that only his shadows could make clear.""
It's the worst feeling in the world when finales don't match up to their predecessors. I lik",star rhys stepped stair took hand night triumphant star eternal sweet terrifying darkness glittering light shadow clear worst feeling world finale match predecessor liked court thorn rose loved court mist fury frankly disappointed court wing ruin first writing desperate need another round editing un
"I wish so much that I could tell you I loved this book... but I just didn't.
After thinking A Court of Mist and Fury was such a huge improvement from A Court of Thorns and Roses, I was really excited for this third installment. I even preordered it. But I really struggled to get into the book from t",wish tell loved book thinking court mist fury huge improvement court thorn rose excited third installment preordered struggled book start pacing issue awkward sex scene nothing disappointment another said dislike maas sex scene best writes strangely word like branding claiming plain icky talk mate g
"I’m wrecked. Because a Court of Wings and Ruin was the BEST CONCLUSION I could ever hope for.
I want to shout THANK YOU SJM for this incredible adventure. Thank you for letting us dream and travel across the stars if only for a short time.
I have been a massive fan of the ACOTAR series since the fir",wrecked court wing ruin best conclusion ever hope shout thank sjm incredible adventure thank letting u dream travel across star short time massive fan acotar series since first book highly anticipating acowar afraid like third book loved second hell wrong swear many nerve cell book cost book thrilli
"Yay! Another one of my books won 2017 GR award ❤️
OMG!THIS BOOK!I LOVED IT SO MUCH! AND IT MADE ME CRY! THE FEELS!
I'm NOT even going to hint at any spoilers or go into too much in the book because there are a million people reading it right now.
I must say I loved A Court Of Mist And Fury as my fav",yay another book gr award omg book loved made cry feel going hint spoiler go book million reading right must say loved court mist fury favorite new favorite love rhys feyre cassian azriel lucien nesta elain mor amren random others fight war trying defeat king hybern evil core wo tell happened amaze 
"Congratulations-winner of Best Young Adult Fantasy 2017!
Initially I was so wrapped up in needing closure to this part of the story that I was grabby grabby for anything I could get my hands on, but I can’t stop thinking about how many issues I had with this book. Was it enjoyable? Sure! I loved jum",best young adult fantasy initially wrapped needing closure part story grabby grabby anything hand stop thinking many issue book enjoyable sure loved jumping back old friend seeing going lengthy intro found quite hoped rehash everything detail enough review already done better job feel worth noting t
"In these early days after the release, I'll say little and spoil nothing. This is wholly because I'm considerate and benevolent and not at all because I'm sobbing and incoherent at the end of a favorite trilogy.
Suffice it to say, however, that after all the sentiment holds true:
Welcome to A Court ",early day release say little spoil nothing wholly considerate benevolent sobbing incoherent end favorite trilogy suffice say however sentiment hold true welcome court pain feel home deem hint acceptable gather wit reason meantime try find velaris
"Glorious, thrilling and completely enthralling -- ACOWAR was everything I hoped for and then some. This is how you end a series -- with love and hope and happiness painting the grand finale. Maas deserves thunderous applause yet again.
Review to come.",glorious thrilling completely enthralling acowar everything hoped end series love hope happiness painting grand finale maas deserves thunderous applause yet come
